BEGIN
DO
 no_plan 
---------
(0 rows)

CREATE FUNCTION
INSERT 0 5
INSERT 0 5
DELETE 2
INSERT 0 2
UPDATE 2
INSERT 0 2
CREATE FUNCTION
              set_config              
--------------------------------------
 ac239000-0000-4000-8000-000000000901
(1 row)

SET
                  lives_ok                   
---------------------------------------------
 ok 1 - admin creates independent empty plan
(1 row)

               is               
--------------------------------
 ok 2 - empty board is readable
(1 row)

                    is                     
-------------------------------------------
 ok 3 - full catalogs support empty boards
(1 row)

SELECT 1
                      is                       
-----------------------------------------------
 ok 4 - same actor and key replay exact result
(1 row)

                throws_ok                
-----------------------------------------
 ok 5 - same key different body rejected
(1 row)

                          is                           
-------------------------------------------------------
 ok 6 - item save does not increment metadata revision
(1 row)

                              lives_ok                              
--------------------------------------------------------------------
 ok 7 - adjacent half-open placement and distinct item save succeed
(1 row)

            lives_ok             
---------------------------------
 ok 8 - alternative plan created
(1 row)

                               lives_ok                                
-----------------------------------------------------------------------
 ok 9 - identical teacher room and time in another plan is independent
(1 row)

RESET
                                throws_ok                                
-------------------------------------------------------------------------
 ok 10 - composite FK rejects cross-plan item even for privileged insert
(1 row)

SET
                 throws_ok                 
-------------------------------------------
 ok 11 - same-item stale revision rejected
(1 row)

                      throws_ok                       
------------------------------------------------------
 ok 12 - same plan teacher and room conflict rejected
(1 row)

                 throws_ok                  
--------------------------------------------
 ok 13 - lifecycle field injection rejected
(1 row)

                throws_ok                 
------------------------------------------
 ok 14 - duplicate slot identity rejected
(1 row)

                       throws_ok                       
-------------------------------------------------------
 ok 15 - same room conflicts even with another teacher
(1 row)

                      throws_ok                      
-----------------------------------------------------
 ok 16 - same teacher conflicts even in another room
(1 row)

                         throws_ok                          
------------------------------------------------------------
 ok 17 - same item overlaps even when both resources differ
(1 row)

                 throws_ok                 
-------------------------------------------
 ok 18 - stale shadow fingerprint rejected
(1 row)

                 throws_ok                 
-------------------------------------------
 ok 19 - source provenance is server-owned
(1 row)

                      is                      
----------------------------------------------
 ok 20 - per plan signal matches item changes
(1 row)

RESET
INSERT 0 1
  set_config  
--------------
 release2-rpc
(1 row)

INSERT 0 1
SET
                          is                           
-------------------------------------------------------
 ok 21 - all subjects contribute authoritative shadows
(1 row)

                               lives_ok                                
-----------------------------------------------------------------------
 ok 22 - name-only edit preserves newly conflicting original occupancy
(1 row)

                           throws_ok                            
----------------------------------------------------------------
 ok 23 - hidden subject operational shadow blocks new placement
(1 row)

                         lives_ok                         
----------------------------------------------------------
 ok 24 - safe repair moves out of unchanged live conflict
(1 row)

RESET
UPDATE 1
SET
                          lives_ok                          
------------------------------------------------------------
 ok 25 - hidden resource unchanged occupancy can be renamed
(1 row)

                      throws_ok                       
------------------------------------------------------
 ok 26 - hidden resource cannot acquire new occupancy
(1 row)

RESET
DELETE 1
 set_config 
------------
 v1
(1 row)

UPDATE 1
DELETE 1
SET
                          is                           
-------------------------------------------------------
 ok 27 - deleted resource retains original stable UUID
(1 row)

                           lives_ok                           
--------------------------------------------------------------
 ok 28 - deleted resource snapshot permits non-occupancy edit
(1 row)

                 lives_ok                  
-------------------------------------------
 ok 29 - second plan created independently
(1 row)

                   lives_ok                   
----------------------------------------------
 ok 30 - other plan has independent occupancy
(1 row)

                 throws_ok                  
--------------------------------------------
 ok 31 - another plan slot cannot be stolen
(1 row)

                   lives_ok                   
----------------------------------------------
 ok 32 - metadata rename changes own revision
(1 row)

                           is                           
--------------------------------------------------------
 ok 33 - metadata rename leaves item revision unchanged
(1 row)

                throws_ok                
-----------------------------------------
 ok 34 - old metadata guard rejects save
(1 row)

               lives_ok                
---------------------------------------
 ok 35 - archive is metadata operation
(1 row)

              throws_ok              
-------------------------------------
 ok 36 - archived plans are readonly
(1 row)

       lives_ok       
----------------------
 ok 37 - restore plan
(1 row)

RESET
INSERT 0 1
UPDATE 1
SET
                                  is                                   
-----------------------------------------------------------------------
 ok 38 - applied item whose source was deleted stays out of draft grid
(1 row)

                                      is                                       
-------------------------------------------------------------------------------
 ok 39 - applied snapshot remains separate after applied class ID becomes null
(1 row)

             throws_ok             
-----------------------------------
 ok 40 - applied item is immutable
(1 row)

                            lives_ok                            
----------------------------------------------------------------
 ok 41 - clone preserves unavailable draft resources for repair
(1 row)

                     is                      
---------------------------------------------
 ok 42 - whole clone copies draft slots only
(1 row)

                       is                        
-------------------------------------------------
 ok 43 - applied source clones to unplaced draft
(1 row)

                  ok                  
--------------------------------------
 ok 44 - clone allocates new item IDs
(1 row)

                  ok                  
--------------------------------------
 ok 45 - clone allocates new slot IDs
(1 row)

                         lives_ok                          
-----------------------------------------------------------
 ok 46 - explicit delete atomically removes item and slots
(1 row)

                  is                   
---------------------------------------
 ok 47 - delete removes its placements
(1 row)

RESET
INSERT 0 1
SET
                                  is                                   
-----------------------------------------------------------------------
 ok 48 - complete comma-separated legacy schedule resolves both tokens
(1 row)

                        is                        
--------------------------------------------------
 ok 49 - strict legacy reader keeps exact minutes
(1 row)

                           is                           
--------------------------------------------------------
 ok 50 - legacy exact name resolves stable catalog UUID
(1 row)

                   is                    
-----------------------------------------
 ok 51 - valid legacy occupancy complete
(1 row)

RESET
UPDATE 1
SET
                        is                         
---------------------------------------------------
 ok 52 - unparseable legacy occupancy fails closed
(1 row)

                       is                       
------------------------------------------------
 ok 53 - unresolved class is visible as blocker
(1 row)

                      throws_ok                       
------------------------------------------------------
 ok 54 - incomplete occupancy never becomes free time
(1 row)

RESET
 set_config 
------------
 v1
(1 row)

UPDATE 1
INSERT 0 500
SET
                      is                       
-----------------------------------------------
 ok 55 - 500 items returned without truncation
(1 row)

               throws_ok                
----------------------------------------
 ok 56 - 501st item explicitly rejected
(1 row)

RESET
INSERT 0 1
INSERT 0 2001
SET
                         is                         
----------------------------------------------------
 ok 57 - over-capacity read does not truncate items
(1 row)

                         is                         
----------------------------------------------------
 ok 58 - over-capacity read does not truncate slots
(1 row)

                         is                         
----------------------------------------------------
 ok 59 - capacity overflow is explicitly incomplete
(1 row)

                     throws_ok                     
---------------------------------------------------
 ok 60 - over-capacity board mutations are blocked
(1 row)

                                                                                                                                                                                                                                                                                                                                                                                                                                                                                                                                                                                                                                                                                                                                                                                                                                                                                                                                                                                                                                                                                                                                                                                                                                                                                                                                                                                                                                                                                                                                                                                                                                                                                                                                                                                                   ?column?                                                                                                                                                                                                                                                                                                                                                                                                                                                                                                                                                                                                                                                                                                                                                                                                                                                                                                                                                                                                                                                                                                                                                                                                                                                                                                                                                                                                                                                                                                                                                                                                                                                                                                                                                                                                    
---------------------------------------------------------------------------------------------------------------------------------------------------------------------------------------------------------------------------------------------------------------------------------------------------------------------------------------------------------------------------------------------------------------------------------------------------------------------------------------------------------------------------------------------------------------------------------------------------------------------------------------------------------------------------------------------------------------------------------------------------------------------------------------------------------------------------------------------------------------------------------------------------------------------------------------------------------------------------------------------------------------------------------------------------------------------------------------------------------------------------------------------------------------------------------------------------------------------------------------------------------------------------------------------------------------------------------------------------------------------------------------------------------------------------------------------------------------------------------------------------------------------------------------------------------------------------------------------------------------------------------------------------------------------------------------------------------------------------------------------------------------------------------------------------------------------------------------------------------------------------------------------------------------------------------------------------------------------------------------------------------------------------------------------------------------------------------------------------------------------------------------------------------------------------------------------------------------------------------------------------------------------------------------------------------------------------------------------------------------------------------------------------------------------------------------------------------------------------------------------------------------------------------------------------------------------------------------------------------------------------------------------------------------------------------------------------------------------------------------------------------------------------------------------------------------------------------------------------------------------------------------------------------------------------------------------------------------------------------------------------------------------------------------------------------------------------------------------------------------------------------------------------------------------------------------------------------------------------------------------------------------------------------------------------------------------------------------------------------------------------------------------------------------------------------------------------------------------------------------------------------------------------------------------------------------------------------------------------------------
 CONTRACT_SNAPSHOT={"plan": {"id": "ac239000-0000-4000-8000-000000000001", "name": "변경한 계획", "state": "draft", "metaRevision": 3, "targetEndDate": null, "changeSequence": 9, "targetStartDate": null}, "items": [{"id": "ac239000-0000-4000-8000-000000000011", "name": "초안", "grade": "중2", "state": "draft", "planId": "ac239000-0000-4000-8000-000000000001", "subject": "영어", "tuition": 100000, "capacity": 12, "revision": 5, "appliedAt": null, "pendingSlots": [], "sourceClassId": null, "appliedClassId": null, "subjectAreaKey": null, "durationMinutes": 60, "defaultTeacherId": "ac239000-0000-4000-8000-000000000101", "appliedTransferId": null, "defaultClassroomId": "ac239000-0000-4000-8000-000000000201"}, {"id": "ac239000-0000-4000-8000-000000000012", "name": "초안", "grade": "중2", "state": "applied", "planId": "ac239000-0000-4000-8000-000000000001", "subject": "영어", "tuition": 100000, "capacity": 12, "revision": 1, "appliedAt": "2026-09-23T09:53:40.623544+00:00", "pendingSlots": [], "sourceClassId": null, "appliedClassId": null, "subjectAreaKey": null, "durationMinutes": 60, "defaultTeacherId": "ac239000-0000-4000-8000-000000000101", "appliedTransferId": "ac239000-0000-4000-8000-000000000700", "defaultClassroomId": "ac239000-0000-4000-8000-000000000201"}], "slots": [{"id": "ac239000-0000-4000-8000-000000000111", "itemId": "ac239000-0000-4000-8000-000000000011", "planId": "ac239000-0000-4000-8000-000000000001", "weekday": 1, "endMinute": 780, "teacherId": "ac239000-0000-4000-8000-000000000101", "classroomId": "ac239000-0000-4000-8000-000000000201", "startMinute": 720, "teacherName": "동일 이름", "sourceSlotId": null, "classroomName": "동일 이름"}], "members": [], "asOfDate": "2026-09-23", "capacity": {"exceeded": false, "maxItems": 500, "maxSlots": 2000, "itemCount": 2, "slotCount": 2}, "catalogs": {"teachers": [{"id": "018e8ced-bbc1-4276-bd6a-f1a17ad66321", "name": "plan905", "subjects": ["영어팀"], "isVisible": true}, {"id": "ac239000-0000-4000-8000-000000000102", "name": "다른 교사", "subjects": ["영어"], "isVisible": true}, {"id": "b4ec64da-2c98-4413-9e25-e3f04072a22a", "name": "plan901", "subjects": ["영어팀"], "isVisible": true}, {"id": "b730d9a2-334a-42f1-9f54-e06d5faa3e9f", "name": "plan902", "subjects": ["영어팀"], "isVisible": true}, {"id": "ac239000-0000-4000-8000-000000000101", "name": "동일 이름", "subjects": [], "isMissing": true, "isVisible": false}], "classrooms": [{"id": "ac239000-0000-4000-8000-000000000201", "name": "동일 이름", "subjects": ["영어"], "isVisible": true}, {"id": "ac239000-0000-4000-8000-000000000202", "name": "다른 방", "subjects": ["영어"], "isVisible": true}]}, "complete": true, "permissions": {"canEdit": true, "canManage": true, "canTransfer": true}, "shadowSlots": [], "datedComplete": true, "datedSessions": [], "shadowClasses": [], "appliedSnapshots": [{"slots": [{"id": "ac239000-0000-4000-8000-000000000112", "itemId": "ac239000-0000-4000-8000-000000000012", "planId": "ac239000-0000-4000-8000-000000000001", "weekday": 1, "endMinute": 720, "teacherId": "ac239000-0000-4000-8000-000000000101", "classroomId": "ac239000-0000-4000-8000-000000000201", "startMinute": 660, "teacherName": "동일 이름", "sourceSlotId": null, "classroomName": "동일 이름"}], "itemId": "ac239000-0000-4000-8000-000000000012"}], "datedFingerprint": "d751713988987e9331980363e24189ce", "shadowFingerprint": "6a8977580f6fb8e571bb3be6378ece50", "unresolvedOccupancies": [], "datedUnresolvedOccupancies": []}
(1 row)

                                 ok                                 
--------------------------------------------------------------------
 ok 61 - deleted resource has explicit unavailable display metadata
(1 row)

RESET
CREATE FUNCTION
CREATE FUNCTION
SET
                                                                                 mutate_timetable_plan_v1                                                                                  
-------------------------------------------------------------------------------------------------------------------------------------------------------------------------------------------
 {"plan": {"id": "ac239000-0000-4000-8000-000000000005", "name": "UUID 원자성", "state": "draft", "metaRevision": 0, "targetEndDate": null, "changeSequence": 0, "targetStartDate": null}}
(1 row)

SELECT 1
                               throws_ok                               
-----------------------------------------------------------------------
 ok 62 - uppercase UUID spelling cannot bypass duplicate slot identity
(1 row)

                                           is                                            
-----------------------------------------------------------------------------------------
 ok 63 - mixed-case UUID rejection preserves all plan rows revisions signal and receipts
(1 row)

TRUNCATE TABLE
INSERT 0 1
                              throws_ok                              
---------------------------------------------------------------------
 ok 64 - compact UUID spelling cannot bypass duplicate slot identity
(1 row)

                                               is                                                
-------------------------------------------------------------------------------------------------
 ok 65 - equivalent compact UUID rejection preserves all plan rows revisions signal and receipts
(1 row)

RESET
INSERT 0 1
INSERT 0 1
INSERT 0 1
SET
                                                                                 mutate_timetable_plan_v1                                                                                  
-------------------------------------------------------------------------------------------------------------------------------------------------------------------------------------------
 {"plan": {"id": "ac239000-0000-4000-8000-000000000006", "name": "괄호 legacy", "state": "draft", "metaRevision": 0, "targetEndDate": null, "changeSequence": 0, "targetStartDate": null}}
(1 row)

                                is                                 
-------------------------------------------------------------------
 ok 66 - valid parenthesized legacy schedule has complete snapshot
(1 row)

                                 is                                  
---------------------------------------------------------------------
 ok 67 - per-slot parenthesized labels do not become global blockers
(1 row)

                            is                            
----------------------------------------------------------
 ok 68 - both parenthesized legacy slots are materialized
(1 row)

                                  is                                   
-----------------------------------------------------------------------
 ok 69 - first legacy slot resolves its exact teacher room and minutes
(1 row)

                                    is                                    
--------------------------------------------------------------------------
 ok 70 - second legacy slot resolves a different teacher room and minutes
(1 row)

                             throws_ok                             
-------------------------------------------------------------------
 ok 71 - first per-slot teacher shadow blocks even in another room
(1 row)

                              throws_ok                               
----------------------------------------------------------------------
 ok 72 - second per-slot room shadow blocks even with another teacher
(1 row)

                               lives_ok                               
----------------------------------------------------------------------
 ok 73 - parenthesized legacy shadows permit unrelated safe placement
(1 row)

 finish 
--------
 1..73
(1 row)

ROLLBACK
